<?xml version="1.0" encoding="UTF-8"?>
<IFW xsi:noNamespaceSchemaLocation="CustomConfig.xsd"
     xmlns:xsi="http://www.w3.org/2001/XMLSchema-instance">
  <IFW_RATEPLAN RegExFields="CODE|NAME"/>
  <IFW_ALIAS_MAP AddDependingTable="IFW_EDRC_DESC"
                 AddDependingTableMapping="EDRC_DESC:EDRC_DESC"/>
  <IFW_ALIAS_MAP AddDependingTable="IFW_EDRC_FIELD"
                 AddDependingTableMapping="FIELD_ID:FIELD_ID"/>
  <IFW_APN_MAP AddDependingTable="IFW_APN_GROUP"
               AddDependingTableMapping="APN_GROUP:APN_GROUP"/>
  <IFW_CIBER_OCC AddDependingTable="IFW_NETWORKOPER"
                 AddDependingTableMapping="NO:NO"/>
  <IFW_DICTIONARY AddDependingTable="IFW_QUEUE"
                  AddDependingTableMapping="IMPORT_TABLE:IMPORT_TABLE"/>
  <IFW_DISCARDING AddDependingTable="IFW_PIPELINE"
                  AddDependingTableMapping="PIPELINE:PIPELINE"/>
  <!--IFW_DISCOUNTDETAIL AddDependingTable="IFW_DISCOUNTMASTER"
                      AddDependingTableMapping="DISCOUNTMASTER:DISCOUNTMASTER"/>
  <IFW_DISCOUNTSTEP AddDependingTable="IFW_DISCOUNTRULE"
                    AddDependingTableMapping="DISCOUNTRULE:DISCOUNTRULE"/>
  <IFW_DSCMDL_VER AddDependingTable="IFW_DISCOUNTMODEL"
                  AddDependingTableMapping="DISCOUNTMODEL:DISCOUNTMODEL"/-->
  <IFW_EDRC_FIELD AddDependingTable="IFW_EDRC_DESC"
                  AddDependingTableMapping="EDRC_DESC:EDRC_DESC"/>
  <IFW_EXCHANGE_RATE AddDependingTable="IFW_CURRENCY"
                     AddDependingTableMapping="FROM_CURRENCY:CURRENCY"/>
  <IFW_EXCHANGE_RATE AddDependingTable="IFW_CURRENCY"
                     AddDependingTableMapping="TO_CURRENCY:CURRENCY"/>
  <IFW_GEO_MODEL AddDependingTable="IFW_RULESET"
                 AddDependingTableMapping="RULESET:RULESET"/>
  <IFW_GEO_ZONE AddDependingTable="IFW_IMPACT_CAT"
                AddDependingTableMapping="ZONE_RT:IMPACT_CATEGORY"/>
  <IFW_GEO_ZONE AddDependingTable="IFW_IMPACT_CAT"
                AddDependingTableMapping="ZONE_WS:IMPACT_CATEGORY"/>
  <IFW_GEO_ZONE AddDependingTable="IFW_SERVICE"
                AddDependingTableMapping="SERVICECODE:SERVICECODE"/>
  <IFW_GEO_ZONE AddDependingTable="IFW_ZONEMODEL"
                AddDependingTableMapping="ALT_ZONEMODEL:ZONEMODEL"/>
  <IFW_GEO_ZONE AddDependingTable="IFW_ZONEMODEL"
                AddDependingTableMapping="ZONEMODEL:ZONEMODEL"/>
  <IFW_GEOAREA_LNK AddDependingTable="IFW_GEO_MODEL"
                   AddDependingTableMapping="GEOMODEL:GEOMODEL"/>
  <IFW_GLACCOUNT AddDependingTable="IFW_TAXCODE"
                 AddDependingTableMapping="TAXCODE:TAXCODE"/>
  <IFW_GROUPING AddDependingTable="IFW_EDRC_FIELD"
                AddDependingTableMapping="FIELD_ID:FIELD_ID"/>
  <IFW_GROUPING AddDependingTable="IFW_SCENARIO"
                AddDependingTableMapping="SCENARIO_ID:SCENARIO_ID"/>
  <IFW_HOLIDAY AddDependingTable="IFW_CALENDAR"
               AddDependingTableMapping="CALENDAR:CALENDAR"/>
  <IFW_ICPRODUCT_CNF AddDependingTable="IFW_ICPRODUCT"
                     AddDependingTableMapping="ICPRODUCT:ICPRODUCT"/>
  <IFW_ICPRODUCT_CNF AddDependingTable="IFW_ICPRODUCT_GRP"
                     AddDependingTableMapping="ICPRODUCT_GROUP:ICPRODUCT_GROUP"/>
  <IFW_ICPRODUCT_CNF AddDependingTable="IFW_NETWORKMODEL"
                     AddDependingTableMapping="NETWORKMODEL:NETWORKMODEL"/>
  <IFW_ICPRODUCT_GRP AddDependingTable="IFW_NETWORKMODEL"
                     AddDependingTableMapping="NETWORKMODEL:NETWORKMODEL"/>
  <IFW_ICPRODUCT_RATE AddDependingTable="IFW_ICPRODUCT"
                      AddDependingTableMapping="ICPRODUCT:ICPRODUCT"/>
  <IFW_ICPRODUCT_RATE AddDependingTable="IFW_NETWORKMODEL"
                      AddDependingTableMapping="NETWORKMODEL:NETWORKMODEL"/>
  <IFW_ICPRODUCT_RATE AddDependingTable="IFW_NETWORKOPER"
                      AddDependingTableMapping="NO:NO"/>
  <IFW_ICPRODUCT_RATE AddDependingTable="IFW_RATEPLAN"
                      AddDependingTableMapping="ALT_RATEPLAN:RATEPLAN"/>
  <IFW_ICPRODUCT_RATE AddDependingTable="IFW_RATEPLAN"
                      AddDependingTableMapping="RATEPLAN:RATEPLAN"/>
  <IFW_NETWORKMODEL AddDependingTable="IFW_CURRENCY"
                    AddDependingTableMapping="CURRENCY:CURRENCY"/>
  <IFW_NETWORKMODEL AddDependingTable="IFW_NETWORKOPER"
                    AddDependingTableMapping="NO:NO"/>
  <IFW_NETWORKMODEL AddDependingTable="IFW_RATEPLAN"
                    AddDependingTableMapping="RATEPLAN:RATEPLAN"/>
  <IFW_NETWORKMODEL AddDependingTable="IFW_SYSTEM_BRAND"
                    AddDependingTableMapping="SYSTEM_BRAND:SYSTEM_BRAND"/>
  <IFW_NETWORKOPER AddDependingTable="IFW_CURRENCY"
                   AddDependingTableMapping="CURRENCY:CURRENCY"/>
  <IFW_NETWORKOPER AddDependingTable="IFW_TAXGROUP"
                   AddDependingTableMapping="TAXGROUP:TAXGROUP"/>
  <IFW_NO_BILLRUN AddDependingTable="IFW_NETWORKMODEL"
                  AddDependingTableMapping="NETWORKMODEL:NETWORKMODEL"/>
  <IFW_NO_BILLRUN AddDependingTable="IFW_NETWORKOPER"
                  AddDependingTableMapping="NO:NO"/>
  <IFW_NOPRODUCT AddDependingTable="IFW_CURRENCY"
                 AddDependingTableMapping="CURRENCY:CURRENCY"/>
  <IFW_NOPRODUCT AddDependingTable="IFW_NETWORKOPER"
                 AddDependingTableMapping="NO:NO"/>
  <IFW_NOPRODUCT_CNF AddDependingTable="IFW_ICPRODUCT"
                     AddDependingTableMapping="ICPRODUCT:ICPRODUCT"/>
  <IFW_NOPRODUCT_CNF AddDependingTable="IFW_IMPACT_CAT"
                     AddDependingTableMapping="IMPACT_CATEGORY:IMPACT_CATEGORY"/>
  <IFW_NOPRODUCT_CNF AddDependingTable="IFW_NETWORKOPER"
                     AddDependingTableMapping="NO:NO"/>
  <IFW_NOPRODUCT_CNF AddDependingTable="IFW_NOPRODUCT"
                     AddDependingTableMapping="PRODUCTCODE:PRODUCTCODE"/>
  <IFW_NOPRODUCT_CNF AddDependingTable="IFW_TIMEZONE"
                     AddDependingTableMapping="TIMEZONE:TIMEZONE"/>
  <IFW_NOSP AddDependingTable="IFW_MAP_GROUP"
            AddDependingTableMapping="MAP_GROUP:MAP_GROUP"/>
  <IFW_PIPELINE AddDependingTable="IFW_EDRC_DESC"
                AddDependingTableMapping="EDRC_DESC:EDRC_DESC"/>
  <IFW_POIAREA_LNK AddDependingTable="IFW_NETWORKMODEL"
                   AddDependingTableMapping="NETWORKMODEL:NETWORKMODEL"/>
  <IFW_POIAREA_LNK AddDependingTable="IFW_POI"
                   AddDependingTableMapping="POI:POI"/>
  <IFW_PRICEMODEL AddDependingTable="IFW_PRICEMDL_STEP"
                  AddDependingTableMapping="PRICEMODEL:PRICEMODEL"/>
  <IFW_RATEADJUST AddDependingTable="IFW_RATEPLAN"
                  AddDependingTableMapping="RATEPLAN:RATEPLAN"/>
  <IFW_RATEADJUST AddDependingTable="IFW_RATEPLAN_VER"
                  AddDependingTableMapping="RATEPLAN:RATEPLAN"/>
  <IFW_RATEPLAN AddDependingTable="IFW_RATEPLAN_VER"
                AddDependingTableMapping="RATEPLAN:RATEPLAN"/>
  <IFW_RATEPLAN AddDependingTable="IFW_RATEPLAN_CNF"
                AddDependingTableMapping="RATEPLAN:RATEPLAN"/>
  <IFW_RATEPLAN AddDependingTable="IFW_RATEADJUST"
                AddDependingTableMapping="RATEPLAN:RATEPLAN"/>
  <IFW_RATEPLAN AddDependingTable="IFW_SPECIALDAY_LNK"
                AddDependingTableMapping="RATEPLAN:RATEPLAN"/>
  <IFW_RATEPLAN_CNF DependingTableNames="IFW_RATEPLAN_VER|IFW_RATEPLAN_CNF"/>
  <IFW_RATEPLAN_CNF DependingTableNames=""/>
  <IFW_RESOURCE AddDependingTable="IFW_CURRENCY"
                AddDependingTableMapping="CURRENCY:CURRENCY"/>
  <IFW_RSC_MAP AddDependingTable="IFW_RSC_GROUP"
               AddDependingTableMapping="RSC_GROUP:RSC_GROUP"/>
  <IFW_RSC_MAP AddDependingTable="IFW_SERVICECLASS"
               AddDependingTableMapping="NEW_SERVICECLASS:SERVICECLASS"/>
  <IFW_RULEITEM AddDependingTable="IFW_RULE"
                AddDependingTableMapping="RULE_ID:RULE_ID"/>
  <IFW_RULESETLIST AddDependingTable="IFW_RULE"
                   AddDependingTableMapping="RULE_ID:RULE_ID"/>
  <IFW_RULESETLIST AddDependingTable="IFW_RULESET"
                   AddDependingTableMapping="RULESET:RULESET"/>
  <IFW_RUMGROUP_LNK AddDependingTable="IFW_RUM"
                    AddDependingTableMapping="RUM:RUM"/>
  <IFW_RUMGROUP_LNK AddDependingTable="IFW_RUMGROUP"
                    AddDependingTableMapping="RUMGROUP:RUMGROUP"/>
  <IFW_RUMGROUP_LNK AddDependingTable="IFW_UOM"
                    AddDependingTableMapping="UOM:UOM"/>
  <IFW_SCENARIO AddDependingTable="IFW_EDRC_DESC"
                AddDependingTableMapping="EDRC_DESC:EDRC_DESC"/>
  <IFW_SEGRATE_LNK AddDependingTable="IFW_RATEPLAN"
                   AddDependingTableMapping="RATEPLAN:RATEPLAN"/>
  <IFW_SEGRATE_LNK AddDependingTable="IFW_SEGMENT"
                   AddDependingTableMapping="SEGMENT:SEGMENT"/>
  <IFW_SEGZONE_LNK AddDependingTable="IFW_SEGMENT"
                   AddDependingTableMapping="SEGMENT:SEGMENT"/>
  <IFW_SEGZONE_LNK AddDependingTable="IFW_ZONEMODEL"
                   AddDependingTableMapping="ZONEMODEL:ZONEMODEL"/>
  <IFW_SELECTOR_BLOCK_LNK AddDependingTable="IFW_SELECTOR_BLOCK"
                          AddDependingTableMapping="SELECTOR_BLOCK:SELECTOR_BLOCK"/>
  <IFW_SELECTOR_BLOCK_LNK AddDependingTable="IFW_SELECTOR_BLOCK"
                          AddDependingTableMapping="SELECTOR_SUB_BLOCK:SELECTOR_BLOCK"/>
  <IFW_SELECTOR_BLOCK_LNK AddDependingTable="IFW_SELECTOR_DETAIL"
                          AddDependingTableMapping="SELECTOR_DETAIL:SELECTOR_DETAIL"/>
  <IFW_SELECTOR_RULE_LNK AddDependingTable="IFW_SELECTOR_BLOCK"
                         AddDependingTableMapping="SELECTOR_BLOCK:SELECTOR_BLOCK"/>
  <!--IFW_SELECTOR_RULE_LNK AddDependingTable="IFW_SELECTOR_DETAIL"
                         AddDependingTableMapping="SELECTOR_DETAIL:SELECTOR_DETAIL"/-->
  <IFW_SELECTOR_RULE_LNK AddDependingTable="IFW_SELECTOR_RULE"
                         AddDependingTableMapping="SELECTOR_RULE:SELECTOR_RULE"/>
  <IFW_SELECTOR_RULESET AddDependingTable="IFW_MODEL_SELECTOR"
                        AddDependingTableMapping="MODEL_SELECTOR:MODEL_SELECTOR"/>